{
  "artifact_id": "sha256:f89d5202652760a8f67aad3c714190f4b0253daef8c670e9b4051d5b5846febf",
  "artifact_kind": "tei",
  "content": 
  {
    "byte_length": 36619,
    "content_hash": "sha256:91c38531ba45803f0114c7f216e43f6107aff0ff03793812126d7e2dd8cd7ac1",
    "media_type": "application\/tei+xml",
    "path_hint": "tei.xml"
  },
  "invalidated_at": null,
  "license": null,
  "manifest_identity_object": 
  {
    "aat_parser_ir_mapping_hash": null,
    "analysis_recipe_hash": null,
    "corpus_snapshot_hash": "sha256:537736a73abf100317a371791533cdb2dc0ed5c8fc4d4f23a8a822174a929586",
    "manifest_schema_hash": "sha256:c8492e91c2fe3af48e3efe92b8a83b1f0a51775186805764877bbec8835b510e",
    "metadata_record_hash": "sha256:2c280415e626b6a87ae7150631257b89162c4b80d37aa787487e47e345469033",
    "output_format_spec_hash": "sha256:cc6e2c5c740c0a210e1a7081fda3276559099e3fd54f0d0e4c62746867b1b8c8",
    "parser_build_hash": null,
    "parser_config_hash": null,
    "parser_ir_schema_hash": "sha256:41c43f0c88a66c31ae4fbf9b9eeb04de92756082acaaaa1c2e21f1a5bf74a396",
    "tei_profile_hash": "sha256:cc6e2c5c740c0a210e1a7081fda3276559099e3fd54f0d0e4c62746867b1b8c8",
    "tokenizer_build_hash": null,
    "tokenizer_dictionary_hash": null,
    "work_content_hash": "sha256:03def0d5f4322d1cf1bb812a7cca4e490464cb95090182a34a6e2665dde22ba7"
  },
  "manifest_schema_id": "https:\/\/w3id.org\/abc\/schemas\/manifest.schema.json",
  "notes": "Generated from parser-IR by ABC TEI publication renderer.",
  "provenance": 
  {
    "activity_id": "https:\/\/w3id.org\/abc\/activity\/materialize-parser-ir-tei",
    "agent": "abc.tools.materialize-publication",
    "generated_at": "2026-07-04T00:00:00Z",
    "plan_hash": null,
    "used": ["sha256:03def0d5f4322d1cf1bb812a7cca4e490464cb95090182a34a6e2665dde22ba7","sha256:2c280415e626b6a87ae7150631257b89162c4b80d37aa787487e47e345469033","sha256:41c43f0c88a66c31ae4fbf9b9eeb04de92756082acaaaa1c2e21f1a5bf74a396","sha256:537736a73abf100317a371791533cdb2dc0ed5c8fc4d4f23a8a822174a929586","sha256:cc6e2c5c740c0a210e1a7081fda3276559099e3fd54f0d0e4c62746867b1b8c8"],
    "was_derived_from": ["sha256:03def0d5f4322d1cf1bb812a7cca4e490464cb95090182a34a6e2665dde22ba7","sha256:537736a73abf100317a371791533cdb2dc0ed5c8fc4d4f23a8a822174a929586"]
  },
  "replacement_reason": null,
  "sidecars": [
    {
      "hash": "sha256:5c8f085773d9617d842851b53b5f95a77d5284c7034a5889b0dff9759958f788",
      "media_type": "application\/json",
      "path_hint": "tei-validation-result.json",
      "role": "validation-result"
    }],
  "signatures": [],
  "superseded_by": null,
  "validation_status": "passed"
}
